,Store ID,Name,Brand,Store Number,Phone Number,Ownership Type,Street Combined,Street 1,Street 2,Street 3,City,State,Country,Postal Code,Coordinates,Latitude,Longitude,Timezone,Current Timezone Offset,Olson Timezone,First Seen,Mon,Tue,Wed,Thu,Fri,Sat,Sun
21700,1009843,Bandra West - Link corner,Starbucks,24199-236567,,JV,"Off Linking Road, Corner of 24th & 33rd Rd, Bandra West",Off Linking Road,"Corner of 24th & 33rd Rd, Bandra West",,Mumbai,MH,IN,400050,"(19.0655384063721, 72.8331756591797)",19.06553841,72.83317566,India Standard Time,330,GMT+05:30 Asia/New_Delhi,07/30/2015 04:00:00 AM,290,161,303,404,497,592,407
21705,1012310,Numgambakkam,Starbucks,26083-243525,,JV,"Ground Floor, Bergamo Mall, Khadar Nawas Khan Road","Ground Floor, Bergamo Mall",Khadar Nawas Khan Road,,Chennai,TN,IN,600006,"(13.0606746673584, 80.2511978149414)",13.06067467,80.25119781,India Standard Time,330,GMT+05:30 Asia/New_Delhi,07/30/2015 04:00:00 AM,264,196,369,291,538,525,366
22103,1013108,Alwarpet,Starbucks,27719-248626,,JV,"Ground Floor, MGN Splendor, Off Chamiers Road, Alwarpet","Ground Floor, MGN Splendor","Off Chamiers Road, Alwarpet",,Chennai,TN,IN,600018,"(13.0292959213257, 80.2484741210938)",13.02929592,80.24847412,India Standard Time,330,GMT+05:30 Asia/New_Delhi,09/23/2015 04:00:00 AM,294,100,365,378,450,573,356
22287,1011732,Vikhroli East,Starbucks,24734-238829,,JV,"Ground Floor, Godrej One Building, Pirojshanagar, Vikhroli (East)","Ground Floor, Godrej One Building","Pirojshanagar, Vikhroli (East)",,Mumbai,MH,IN,400079,"(19.0939350128174, 72.9230499267578)",19.09393501,72.92304993,India Standard Time,330,GMT+05:30 Asia/New_Delhi,10-07-2015 04:00,314,126,324,435,465,589,395
22622,1013495,Hauz Khas,Starbucks,27717-248629,,JV,"Ground Floor, Power House, Hauz Khas Village, Hauz Khas","Ground Floor, Power House","Hauz Khas Village, Hauz Khas",,New Delhi,DL,IN,110016,"(28.5540676116943, 77.1944122314453)",28.55406761,77.19441223,India Standard Time,330,GMT+05:30 Asia/New_Delhi,11/21/2015 05:00:00 AM,338,161,362,411,510,533,362
22883,1013432,Malad West - Inorbit Mall,Starbucks,26081-243527,,JV,"Ground Floor, Inorbit Mall, Link Road,  Malad (West)","Ground Floor, Inorbit Mall","Link Road,  Malad (West)",,Mumbai,MH,IN,400064,"(19.1726970672607, 72.83544921875)",19.17269707,72.83544922,India Standard Time,330,GMT+05:30 Asia/New_Delhi,12/24/2015 05:00:00 AM,320,176,353,317,513,506,389
23248,1014076,Lower Parel - Marathon Futurex,Starbucks,26080-243526,,JV,"Upper Ground Floor, Marathon Futurex, NM Joshi Marg, Lower Parel","Upper Ground Floor, Marathon Futurex","NM Joshi Marg, Lower Parel",,Mumbai,MH,IN,400013,"(18.9950466156006, 72.8312377929688)",18.99504662,72.83123779,India Standard Time,330,GMT+05:30 Asia/New_Delhi,02/24/2016 05:00:00 AM,258,102,333,313,512,567,391
23250,1013351,Vile Parle West,Starbucks,25658-242046,,JV,"Grd Flr, Tian Star, 48 Gulmohar Road, Juhu Scheme, Vile Parle (West)","Grd Flr, Tian Star, 48 Gulmohar Road","Juhu Scheme, Vile Parle (West)",,Mumbai,MH,IN,400049,"(19.113317489624, 72.8347473144531)",19.11331749,72.83474731,India Standard Time,330,GMT+05:30 Asia/New_Delhi,02/25/2016 05:00:00 AM,337,169,361,444,518,557,358
23333,1013604,Sector 16,Starbucks,25065-239844,,JV,"Ground Floor, Gardens Galleria, Sector 16","Ground Floor, Gardens Galleria",Sector 16,,Noida,UP,IN,201301,"(28.5672473907471, 77.3256378173828)",28.56724739,77.32563782,India Standard Time,330,GMT+05:30 Asia/New_Delhi,03/16/2016 04:00:00 AM,378,171,348,300,471,574,399
23511,1008782,Chhatrapati Shivaji International A,Starbucks,23290-229028,,JV,"T2 Departure SHA, Level P9, Food Court, Andheri (East)","T2 Departure SHA, Level P9","Food Court, Andheri (East)",,Mumbai,MH,IN,400099,"(19.0959987640381, 72.8754730224609)",19.09599876,72.87547302,India Standard Time,330,GMT+05:30 Asia/New_Delhi,04/13/2016 04:00:00 AM,385,126,342,373,542,528,376
23549,1006862,Greater Kailash 2,Starbucks,22572-222668,,JV,"Ground Floor, M-11, M-Block, Main Mrkt, Greater Kailash Pt2","Ground Floor, M-11","M-Block, Main Mrkt, Greater Kailash Pt2",,New Delhi,DL,IN,110048,"(28.5340881347656, 77.2428359985352)",28.53408813,77.242836,India Standard Time,330,GMT+05:30 Asia/New_Delhi,04/21/2016 04:00:00 AM,312,108,395,324,516,535,415
24069,1013433,Bandra East - One BKC,Starbucks,26082-243524,,JV,"A wing, Ground Floor, One BKC, G Block,BandraBurlaComplex,BandraEast","A wing, Ground Floor, One BKC","G Block,BandraBurlaComplex,BandraEast",,Mumbai,MH,IN,400 051,"(19.0566005706787, 72.8519897460938)",19.05660057,72.85198975,India Standard Time,330,GMT+05:30 Asia/New_Delhi,08-02-2016 04:00,388,161,377,427,525,588,354
25056,1015283,One Horizon Center,Starbucks,29490-254064,,JV,Golf Course Road,Golf Course Road,,,Gurgaon,HR,IN,122003,"(28.4756698608398, 77.0937881469727)",28.47566986,77.09378815,India Standard Time,330,GMT+05:30 Asia/New_Delhi,11-04-2016 04:00,330,136,359,426,475,520,378
